,title,abstract,affiliations,authors,journal,date,keywords,url
28,"National Trends in Mental Health-Related Emergency Department Visits Among Youth, 2011-2020","Importance:
        
      
      There has been increasing concern about the burden of mental health problems among youth, especially since the COVID-19 pandemic. Trends in mental health-related emergency department (ED) visits are an important indicator of unmet outpatient mental health needs. Objective:
        
      
      To estimate annual trends in mental health-related ED visits among US children, adolescents, and young adults between 2011 and 2020. Design, setting, and participants:
        
      
      Data from 2011 to 2020 in the National Hospital Ambulatory Medical Care Survey, an annual cross-sectional national probability sample survey of EDs, was used to examine mental health-related visits for youths aged 6 to 24 years (unweighted = 49 515). Main outcomes and measures:
        
      
      Mental health-related ED visits included visits associated with psychiatric or substance use disorders and were identified by International Classification of Diseases-Ninth Revision, Clinical Modification (ICD-9-CM; 2011-2015) and ICD-10-CM (2016-2020) discharge diagnosis codes or by reason-for-visit (RFV) codes. We estimated the annual proportion of mental health-related pediatric ED visits from 2011 to 2020. Subgroup analyses were performed by demographics and broad psychiatric diagnoses. Multivariable-adjusted logistic regression analyses estimated factors independently associated with mental health-related ED visits controlling for period effects. Results:
        
      
      From 2011 to 2020, the weighted number of pediatric mental health-related visits increased from 4.8 million (7.7% of all pediatric ED visits) to 7.5 million (13.1% of all ED visits) with an average annual percent change of 8.0% (95% CI, 6.1%-10.1%; P < .001). Significant linearly increasing trends were seen among children, adolescents, and young adults, with the greatest increase among adolescents and across sex and race and ethnicity. While all types of mental health-related visits significantly increased, suicide-related visits demonstrated the greatest increase from 0.9% to 4.2% of all pediatric ED visits (average annual percent change, 23.1% [95% CI, 19.0%-27.5%]; P < .001). Conclusions and relevance:
        
      
      Over the last 10 years, the proportion of pediatric ED visits for mental health reasons has approximately doubled, including a 5-fold increase in suicide-related visits. These findings underscore an urgent need to improve crisis and emergency mental health service capacity for young people, especially for children experiencing suicidal symptoms.","['1 Department of Psychiatry and Psychology, Mayo Clinic, Rochester, Minnesota.', '2 Department of Psychiatry, Vagelos College of Physicians and Surgeons, Columbia University Irving Medical Center, New York, New York.', '3 Department of Psychiatry, Yale University School of Medicine, New Haven, Connecticut.', '4 New England Mental Illness, Research Education, and Clinical Center, VA Connecticut Healthcare System, West Haven, Connecticut.', '5 Department of Public Health Sciences, University of Connecticut School of Medicine, Farmington.']","Tanner J Bommersbach, Alastair J McKean, Mark Olfson, Taeho Greg Rhee, ",JAMA,2023,NO_KEYWORDS,https://pubmed.ncbi.nlm.nih.gov/37129655
29,Race as a Structural Determinant of Mental Health,NO_ABSTRACT,"['1 Capstone College of Nursing, The University of Alabama.', '2 Center for Substance Use Research and Related Conditions, Capstone College of Nursing, The University of Alabama, Tuscaloosa, Alabama.']","Wanda Martin Burton, Mercy Ngosa Mumba, ",Journal of psychosocial nursing and mental health services,NO_DATE,NO_KEYWORDS,https://pubmed.ncbi.nlm.nih.gov/38315974
30,Mental health challenges faced by autistic people,"Mental health challenges impede the well-being of autistic people. This Review outlines contributing neurodevelopmental and physical health conditions, rates and developmental trajectories of mental health challenges experienced by autistic people, as well as unique clinical presentations. A framework is proposed to consider four contributing themes to aid personalized formulation: social-contextual determinants, adverse life experiences, autistic cognitive features, and shared genetic and early environmental predispositions. Current evidence-based and clinical-knowledge-informed intervention guidance and ongoing development of support are highlighted for specific mental health areas. Tailored mental health support for autistic people should be neurodivergence-informed, which is fundamentally humanistic and compatible with the prevailing bio-psycho-social frameworks. The personalized formulation should be holistic, considering physical health and transdiagnostic neurodevelopmental factors, intellectual and communication abilities, and contextual-experiential determinants and their interplay with autistic cognition and biology, alongside resilience. Supporting family well-being is integral. Mutual empathic understanding is fundamental to creating societies in which people across neurotypes are all empowered to thrive.","['1 Margaret and Wallace McCain Centre for Child, Youth & Family Mental Health and Azrieli Adult Neurodevelopmental Centre, Campbell Family Mental Health Research Institute, Centre for Addiction and Mental Health, Toronto, Ontario, Canada. mengchuan.lai@utoronto.ca.', '2 Department of Psychiatry, Temerty Faculty of Medicine, University of Toronto, Toronto, Ontario, Canada. mengchuan.lai@utoronto.ca.', '3 Department of Psychology, Faculty of Arts and Science, University of Toronto, Toronto, Ontario, Canada. mengchuan.lai@utoronto.ca.', '4 Department of Psychiatry, Hospital for Sick Children, Toronto, Ontario, Canada. mengchuan.lai@utoronto.ca.', '5 Autism Research Centre, Department of Psychiatry, University of Cambridge, Cambridge, UK. mengchuan.lai@utoronto.ca.', '6 Department of Psychiatry, National Taiwan University Hospital and College of Medicine, Taipei, Taiwan. mengchuan.lai@utoronto.ca.']","Meng-Chuan Lai, ",Nature human behaviour,NO_DATE,NO_KEYWORDS,https://pubmed.ncbi.nlm.nih.gov/37864080
31,Mental Health of Elite Sport Coaches and Entourage,"There is growing understanding of the extent of mental health problems, and related mental health needs, among elite athletes. However, far less attention has been paid to mental health among elite coaches and high-performance support staff, the latter including strength and conditioning coaches, physiotherapists, sport psychologists, and other allied health workers in the daily training environment (high-performance support staff are referred to collectively as ""entourage"" throughout this article). The scarcity of research examining mental health among elite coaches and entourage warrants urgent attention, particularly given these individuals share similar performance demands and role-related stressors as elite athletes. This article reviews the available literature on this topic, including (1) an empirical study conducted by the authors with a sample of coaches and entourage from Australia's national high-performance sport system and (2) a case example to illustrate sport-specific and general risk factors that are likely to impact mental health in elite sporting environments. Avenues for supporting mental health among coaches and entourage are discussed.","['1 The Centre for Youth Mental Health, The University of Melbourne, Melbourne, Australia; Elite Sports and Mental Health, Orygen, 35 Poplar Road, Parkville, Victoria 3052, Australia. Electronic address: rpurcell@unimelb.edu.au.', '2 The Centre for Youth Mental Health, The University of Melbourne, Melbourne, Australia; Elite Sports and Mental Health, Orygen, 35 Poplar Road, Parkville, Victoria 3052, Australia.']","Rosemary Purcell, Joshua Frost, Vita Pilkington, ",Clinics in sports medicine,NO_DATE,Coach; Elite sport; Entourage; Mental health; Support staff; Wellbeing.,https://pubmed.ncbi.nlm.nih.gov/37949512
32,A new approach to global mental health action,NO_ABSTRACT,"['1 South London & Maudsley NHS Foundation Trust, UK.']","Ajoy Thachil, ",The International journal of social psychiatry,NO_DATE,NO_KEYWORDS,https://pubmed.ncbi.nlm.nih.gov/35979549
33,Mental Health Nurses Overcoming Adversity: A Discursive Review,"The mental health nursing profession has experienced various challenges since its inception. This discursive review considers these challenges, including how mental health nurses have and can continue to overcome adversity as individuals and as a profession. The discussion examines the influence of the profession's historical involvement in institutionalization and coercive care; the continuing impact of stigma; and the increasing demand for mental health services, amidst chronic staff shortages. Collectively, mental health nurses must harness strong therapeutic relationships, intra- and multi-disciplinary collaboration, personal and professional resilience, education that prepares them for the future, and sector-wide planning and innovation, to respond positively to these challenges. These approaches will support mental health nurses to overcome adversity and achieve positive outcomes for the profession and people with the lived experience of mental illness.","['1 School of Nursing, Midwifery & Social Sciences, Central Queensland University, Sydney, NSW, Australia.']","Michelle Cleary, Sancia West, Catherine Hungerford, ",Issues in mental health nursing,NO_DATE,NO_KEYWORDS,https://pubmed.ncbi.nlm.nih.gov/37616589
34,Education about Mental Health Firearm Laws Should Be Required in Psychiatry Residency Programs,NO_ABSTRACT,"['1 Dr. Simpson is Adjunct Clinical Associate Professor of Psychiatry (Voluntary) at Keck School of Medicine, University of Southern California, Los Angeles, CA and Clinical Adjunct Faculty, University of Nevada, Reno, Reno, NV. jrsimpsonmd@gmail.com.']","Joseph R Simpson, ",The journal of the American Academy of Psychiatry and the Law,NO_DATE,mental health firearm prohibitions; psychiatric training; restoration of rights.,https://pubmed.ncbi.nlm.nih.gov/36854704
35,Mental health in the community: part one,"Mental health issues are difficult yet common experiences. Considering that one in four people in England experience a mental health problem every year, it is essential that the community nurse has a good understanding of the different types of mental health problems faced by individuals, and be able to adequately provide care and support. In part one of a two-part series on mental health in the community, Sarah Palmer provides details on some of the more common mental health conditions, and the support that primary care can provide to individuals experiencing mental health issues.","['1 Registered nurse and freelance writer, based at the Department for Work and Pensions as a disability analyst.']","Sarah Jane Palmer, ",British journal of community nursing,2023,Mental health; assessment; community nursing.,https://pubmed.ncbi.nlm.nih.gov/37261985
36,Innovative approaches to improving mental health and well-being in older people,NO_ABSTRACT,"['1 School of Psychology, The University of Queensland, Brisbance, QLD4072, Australia.']","Nancy A Pachana, ",International psychogeriatrics,NO_DATE,NO_KEYWORDS,https://pubmed.ncbi.nlm.nih.gov/36927710
37,Digitalising mental health care: Practical recommendations from the European Psychiatric Association,"The digitalisation of mental health care is expected to improve the accessibility and quality of specialised treatment services and introduce innovative methods to study, assess, and monitor mental health disorders. In this narrative review and practical recommendation of the European Psychiatric Association (EPA), we aim to help healthcare providers and policymakers to navigate this rapidly evolving field. We provide an overview of the current scientific and implementation status across two major domains of digitalisation: i) digital mental health interventions and ii) digital phenotyping, discuss the potential of each domain to improve the accessibility and outcomes of mental health services, and highlight current challenges faced by researchers, clinicians, and service users. Furthermore, we make several recommendations meant to foster the widespread adoption of evidence-based digital solutions for mental health care in the member states of the EPA. To realise the vision of a digitalised, patient-centred, and data-driven mental health ecosystem, a number of implementation challenges must be considered and addressed, spanning from human, technical, ethical-legal, and economic barriers. The list of priority areas and action points our expert panel has identified could serve as a playbook for this process.","['1 Institute of Psychiatric Phenomics and Genomics (IPPG), University Hospital, LMU Munich, Munich, Germany.', '2 Department of Psychiatry and Psychotherapy, LMU University Hospital, Munich, Germany.', '3 Department of Psychiatry, Pomeranian Medical University, Szczecin, Poland.', '4 MGZ - Medizinisch Genetisches Zentrum, Munich, Germany.', '5 Collaborative Antwerp Psychiatric Research Institute (CAPRI), University of Antwerp, Antwerp, Belgium.', '6 Department of Psychiatry, Bezmialem Vakıf University Faculty of Medicine, Istanbul, Turkey.', '7 North-Buda Saint John Central Hospital, Buda Family Centred Mental Health Centre, Department of Psychiatry and Psychiatric Rehabilitation, Teaching Department of Semmelweis University, Budapest, Hungary.', '8 National Advisory Unit on Concurrent Substance Abuse and Mental Health Disorders, Innlandet Hospital Trust, Hamar, Norway, Faculty of Social and Health Sciences, Inland Norway University of Applied Sciences, Elverum, Norway.', '9 Psychiatric University Clinic of Charité at St. Hedwig Hospital, Berlin, Germany.', '10 Mental Health Service, Parc Taulí University Hospital, Unitat Mixta de Neurociència Traslacional I3PT-INc-UAB, Sabadell, Spain.', '11 Department of Psychiatry and Forensic Medicine, Autonomous University of Barcelona, Cerdanyola del Vallès, Spain.', '12 Centro de Investigación Biomédica en Red de Salud Mental (CIBERSAM), Madrid, Spain.', '13 CNWL NHS Foundation Trust, London, UK.', '14 WHO Collaborating Centre DEU-131, VR-Klinikum Düsseldorf, Department of Psychiatry and Psychotherapy, Heinrich-Heine-Universität Düsseldorf, Düsseldorf, Germany.', '15 Unit of Clinical Psychiatry, Department of Clinical Neurosciences/DIMSC, School of Medicine, Università Politecnica delle Marche, Ancona, Italy.']","Janos L Kalman, Gerrit Burkhardt, Jerzy Samochowiec, Christian Gebhard, Geert Dom, Miriam John, Ozge Kilic, Tamas Kurimay, Lars Lien, Meryam Schouler-Ocak, Diego Palao Vidal, Jan Wiser, Wolfgang Gaebel, Umberto Volpe, Peter Falkai, ",European psychiatry : the journal of the Association of European Psychiatrists,2023,European Psychiatric Association; digital mental health; digital mental health interventions; digital phenotyping; telepsychiatry.,https://pubmed.ncbi.nlm.nih.gov/38086744
38,Pros & cons: impacts of social media on mental health,"The use of social media significantly impacts mental health. It can enhance connection, increase self-esteem, and improve a sense of belonging. But it can also lead to tremendous stress, pressure to compare oneself to others, and increased sadness and isolation. Mindful use is essential to social media consumption.","['1 Institute of Psychology, Pázmány Péter Catholic University, Budapest, Hungary.', '2 Institute of Psychology, ELTE Eötvös Loránd University, Budapest, Hungary.', '3 Department of Psychology, College of Science, University of Santo Tomas, Manila, 1008, Philippines. msreyes@ust.edu.ph.']","Ágnes Zsila, Marc Eric S Reyes, ",BMC psychology,2023,Benefits; Impact; Mental health; Risks; Social media.,https://pubmed.ncbi.nlm.nih.gov/37415227
39,Mental health and the covid-19 pandemic,NO_ABSTRACT,"['1 Copenhagen Research Centre for Mental Health-CORE, Mental Health Centre Copenhagen, Copenhagen University Hospital, Copenhagen, Denmark Carsten.hjorthoej@regionh.dk.', '2 Department of Public Health, Section of Epidemiology, University of Copenhagen, Copenhagen, Denmark.', '3 Copenhagen Research Centre for Mental Health-CORE, Mental Health Centre Copenhagen, Copenhagen University Hospital, Copenhagen, Denmark.']","Carsten Hjorthøj, Trine Madsen, ",BMJ (Clinical research ed.),2023,NO_KEYWORDS,https://pubmed.ncbi.nlm.nih.gov/36889801
40,Study of sociobiological interactions to understand regional mental health disparities,NO_ABSTRACT,"['1 Director Doctorado de Neurociencias, Pontifica Universidad Javeriana de Colombia PhD Program of Neuroscience; Editor Revista Colombiana de Psiquiatría. Electronic address: hernando.santamaria@javeriana.edu.co.']","Hernando Santamaría-García, ",Revista Colombiana de psiquiatria (English ed.),NO_DATE,NO_KEYWORDS,https://pubmed.ncbi.nlm.nih.gov/37863764
41,Children's Mental Health in a Pandemic-Altered World: Technology's Evolving Role,NO_ABSTRACT,NO_AFFILIATIONS,"Brenda K Wiederhold, ","Cyberpsychology, behavior and social networking",NO_DATE,NO_KEYWORDS,https://pubmed.ncbi.nlm.nih.gov/36656146
42,Commercial determinants of mental health,NO_ABSTRACT,"[""1 Mental Health and Cultural Diversity, Institute of Psychiatry, Psychology and Neuroscience, King's College London, UK."", '2 University of Foggia, Italy.']","Dinesh Bhugra, Antonio Ventriglio, ",The International journal of social psychiatry,NO_DATE,NO_KEYWORDS,https://pubmed.ncbi.nlm.nih.gov/37191310
43,Mental Health of the World's Women in 2023,NO_ABSTRACT,"['1 College of Nursing, University of Tennessee, Knoxville, Knoxville, Tennessee, USA.']","Sandra P Thomas, ",Issues in mental health nursing,NO_DATE,NO_KEYWORDS,https://pubmed.ncbi.nlm.nih.gov/37643217
44,Global Mental Health,NO_ABSTRACT,NO_AFFILIATIONS,"Mariana Pinto da Costa, Lisa B Dixon, ","Psychiatric services (Washington, D.C.)",2023,NO_KEYWORDS,https://pubmed.ncbi.nlm.nih.gov/37122267
45,Public Mental Health - time to embrace a different approach,NO_ABSTRACT,"['1 Department of Psychiatry, RCSI University of Medicine and Health Sciences, Dublin, Ireland.']","David Cotter, ",Irish journal of psychological medicine,NO_DATE,Public mental health.,https://pubmed.ncbi.nlm.nih.gov/36940728
46,Managing Mental Health: Eight Extraordinary Vessels,NO_ABSTRACT,"[""1 Siobhan Hutchinson, MA , created Next Step Strategies, LLC, to educate and encourage individuals to discover their body's natural healing ability. Her clients report experiencing increased range of motion, balance, relaxation, reduced stress, and an overall sense of well-being. Siobhan received her master's degree in Holistic Health from Georgian Court University and is an accredited T'ai Chi Chih, Seijaku, Guigen Qigong, Reiki Master/Teacher, Medicinal Aromatherapist, and Certified Clinical Eden Energy Medicine Practitioner. The United Fellowship of Martial Artists awarded her Holistic Healing Artist & Qigong Master. She has studied in China and continues her studies with a variety of holistic practitioners. Her passion is stress relief and walking in serenity.""]","Siobhan Hutchinson, ",Professional case management,NO_DATE,NO_KEYWORDS,https://pubmed.ncbi.nlm.nih.gov/37487162
47,"The Geography of Mental Health, Urbanicity, and Affluence","Residential location has been shown to significantly impact mental health, with individuals in rural communities experiencing poorer mental health compared to those in urban areas. However, the influence of an individual's social group on the relationship between residential location and mental health outcomes remains unclear. This study disaggregates the rural-urban binary and investigates how geography and social groupings interact to shape mental health outcomes. Merging data from PLACES and Claritas PRIZM, we conducted a hotspot analysis, generated bivariate choropleth maps, and applied multiscale geographically weighted regressions to examine the spatial distribution of mental health and social groupings. Our findings reveal that mental health is influenced by complex interactions, with social groups playing a critical role. Our study highlights that not all rural and urban areas are alike, and the extent to which social groups influence mental health outcomes varies within and across these areas. These results underscore the need for policies that are tailored to meet the unique mental health needs of individuals from different social groups in specific geographic locations to inform policy interventions that more effectively address mental health disparities across diverse communities.","['1 Department of Political Science and Population Health, University of Houston, Houston, TX 77204, USA.']","Jeronimo Cortina, Shana Hardin, ",International journal of environmental research and public health,2023,geography; geospatial statistics; mental health; social groups.,https://pubmed.ncbi.nlm.nih.gov/37107722
48,Green Peace,NO_ABSTRACT,"['1 Department of Medicine, Johns Hopkins University School of Medicine, Baltimore, Maryland.']","Samuel C Durso, ",JAMA,2023,NO_KEYWORDS,https://pubmed.ncbi.nlm.nih.gov/37889508
49,Racial and Ethnic Disparities in Mental Health and Mental Health Care During The COVID-19 Pandemic,"During the pandemic, the overall mental health of the US population declined. Given higher rates of COVID-19 infections and deaths experienced by communities of color along with greater exposure to pandemic-related stressors (e.g., unemployment, food insecurity), we expect that the decline in mental health during the pandemic was more pronounced among Black, Hispanic, and Asian adults, with these groups also having less access to mental health services. We examine two nationally representative US surveys: the 2019 National Household Interview Survey (NHIS; N = 30,368) and the 2020-2021 Household Pulse Survey (HPS; N = 1,677,238). We find mental health of Black, Hispanic, and Asian respondents worsened relative to White respondents during the pandemic, with significant increases in depression and anxiety among racialized minorities compared to Whites. There is also evidence of especially high mental health burden for Black adults around the murder of George Floyd by police and for Asian adults around the murder of six Asian women in Atlanta. White respondents are most likely to receive professional mental health care before and during the pandemic, and Black, Hispanic, and Asian respondents demonstrate higher levels of unmet mental health care needs during the pandemic than White respondents. Our results indicate that within the current environment, White adults are at a large and systemic advantage buffering them from unexpected crises-like the COVID-19 pandemic. Without targeted interventions, the long-term social consequences of the pandemic and other co-occurring events (e.g., death of Black and Hispanic people by police) will likely include widening mental health disparities between racial/ethnic groups.","['1 Department of Sociology, The University of Alabama at Birmingham, Heritage Hall 460, 1401 University Blvd., Birmingham, AL, 35233, USA. mthomeer@uab.edu.', '2 Department of Sociology, The University of Alabama at Birmingham, Heritage Hall 460, 1401 University Blvd., Birmingham, AL, 35233, USA.', '3 Department of Sociology, Bowling Green State University, Bowling Green, OH, USA.']","Mieke Beth Thomeer, Myles D Moody, Jenjira Yahirun, ",Journal of racial and ethnic health disparities,NO_DATE,Racism; Race/ethnicity; Mental health; COVID-19 pandemic; Mental health care; Health disparities.,https://pubmed.ncbi.nlm.nih.gov/35318615
50,Friendship theory for public health research and practice: a critical realist review,"Aims:
        
      
      To critically analyse theories of friendship through privileging research on the experience of friendship among those who have experienced mental ill-health. To inform public health approaches that aim to facilitate friendship and assist those experiencing mental ill-health. Method:
        
      
      A selective, iterative, purposive review of theoretical and empirical studies, within a critical realist epistemology, is undertaken to provide an analysis. Results:
        
      
      Existing theories - exchange and equity, capital, identity, and attachment - all provide some insight into friendship when encountering mental ill-health. However, recognition theory is found to best capture and explain the experience. Conclusion:
        
      
      Recognition theory forms a substantial theoretical foundation for public health initiatives that address friendship and mental ill-health. Friendship can contribute to public mental health, and suggestions are made to give friendship itself recognition within public health frameworks.","['1 Nottinghamshire Healthcare NHS Foundation Trust, Marlow House, Waterford Street, Nottingham NG6 0DH, UK.', '2 University of Nottingham, Nottingham, UK.']","D Doran, A Edgley, ",Perspectives in public health,NO_DATE,friendship; health; mental health; recovery.,https://pubmed.ncbi.nlm.nih.gov/37029523
51,"Special Issue: Place, Space, and Mental Health","Global megatrends, including climate change and urbanisation, are shaping and changing how we live in the future [...].","['1 Faculty of Social Sciences, Tampere University, 33014 Tampere, Finland.', '2 Environmental Health Unit, Finnish Institute for Health and Welfare, 70701 Kuopio, Finland.', '3 Department of Built Environment, School of Engineering, Aalto University, 02150 Espoo, Finland.', '4 Institute for Urban and Regional Research, Austrian Academy of Sciences, 1010 Vienna, Austria.']","Tytti P Pasanen, Anna Kajosaari, ",International journal of environmental research and public health,2023,NO_KEYWORDS,https://pubmed.ncbi.nlm.nih.gov/36981961
